{
  "$schema": "../schemas/vera-encrypted-response.schema.json",
  "schema_version": "somavera.vera-encrypted-response.v1",
  "profile_status": "freeze_blocking_draft",
  "response_envelope_id": "2121212121212121212121212121212121212121212121212121212121212121",
  "network_lineage_id": "somavera:network:v1:bbbbbbbbbbbbbbbbbbbbbbbbbbbbbbbbbbbbbbbbbbbbbbbbbbbbbbbbbbbbbbbb",
  "execution_context_id": "somavera:context:v1:aaaaaaaaaaaaaaaaaaaaaaaaaaaaaaaaaaaaaaaaaaaaaaaaaaaaaaaaaaaaaaaa",
  "request_event_id": "1313131313131313131313131313131313131313131313131313131313131313",
  "response_event_id": "2222222222222222222222222222222222222222222222222222222222222222",
  "response_action": "answer.source-bundle",
  "host_did": "did:key:example-vera-host",
  "destination_soma_did": "did:key:example-soma-agent",
  "recipient_return_key_id": "did:key:example-soma-agent#return-1",
  "return_descriptor_id": "1111111111111111111111111111111111111111111111111111111111111111",
  "return_key_commitment": "1111111111111111111111111111111111111111111111111111111111111111",
  "hpke_suite": "HPKE-Base-X25519-HKDF-SHA256-AES256GCM-v1",
  "hpke_enc": "BQUFBQUFBQUFBQUFBQUFBQUFBQUFBQUFBQUFBQUFBQU=",
  "wrapped_response_dek": "AAAAAAAAAAAAAAAAAAAAAAAAAAAAAAAAAAAAAAAAAAAAAAAAAAAAAAAAAAAAAAAA",
  "chunk_bytes": 65536,
  "chunk_count": 1,
  "plaintext_bytes": 2,
  "aad_hash": "2424242424242424242424242424242424242424242424242424242424242424",
  "ciphertext_root": "2525252525252525252525252525252525252525252525252525252525252525",
  "issued_at": "2027-01-01T00:00:01Z",
  "expires_at": "2027-01-01T00:15:00Z",
  "chunks": [
    {
      "index": 0,
      "plaintext_bytes": 2,
      "nonce": "BgYGBgYGBgYGBgYG",
      "ciphertext_hash": "2626262626262626262626262626262626262626262626262626262626262626",
      "ciphertext": "AAAAAAAAAAAAAAAAAAAAAAAA"
    }
  ],
  "outer_signature": {
    "suite": "Ed25519-v1",
    "key_id": "did:key:example-vera-host#signing-1",
    "value": "AAAAAAAAAAAAAAAAAAAAAAAAAAAAAAAAAAAAAAAAAAAAAAAAAAAAAAAAAAAAAAAAAAAAAAAAAAAAAAAAAAAAAA=="
  }
}
